{
  "$schema": "http://json-schema.org/draft-07/schema#",
  "type": "object",
  "required": ["layout", "meta", "hero", "benefits", "features"],
  "properties": {
    "layout": {
      "type": "string",
      "const": "landing-page-anduril"
    },
    "meta": {
      "type": "object",
      "required": ["title", "description"],
      "properties": {
        "title": {
          "type": "string",
          "minLength": 10,
          "maxLength": 70
        },
        "description": {
          "type": "string",
          "minLength": 20,
          "maxLength": 160
        }
      }
    },
    "hero": {
      "type": "object",
      "required": ["category", "title", "description", "cta"],
      "properties": {
        "category": {
          "type": "string",
          "minLength": 2,
          "maxLength": 50
        },
        "title": {
          "type": "string",
          "minLength": 10,
          "maxLength": 100
        },
        "description": {
          "type": "string",
          "minLength": 20,
          "maxLength": 300
        },
        "cta": {
          "type": "object",
          "required": ["primary", "secondary"],
          "properties": {
            "primary": {
              "type": "object",
              "required": ["text", "href"],
              "properties": {
                "text": { "type": "string" },
                "href": { "type": "string" }
              }
            },
            "secondary": {
              "type": "object",
              "required": ["text", "href"],
              "properties": {
                "text": { "type": "string" },
                "href": { "type": "string" }
              }
            }
          }
        }
      }
    },
    "benefits": {
      "type": "object",
      "required": ["title", "items"],
      "properties": {
        "title": {
          "type": "string",
          "minLength": 5,
          "maxLength": 100
        },
        "items": {
          "type": "array",
          "minItems": 1,
          "maxItems": 6,
          "items": {
            "type": "object",
            "required": ["title", "description"],
            "properties": {
              "title": {
                "type": "string",
                "minLength": 5,
                "maxLength": 80
              },
              "description": {
                "type": "string",
                "minLength": 20,
                "maxLength": 300
              }
            }
          }
        }
      }
    },
    "features": {
      "type": "object",
      "required": ["title", "items"],
      "properties": {
        "title": {
          "type": "string",
          "minLength": 5,
          "maxLength": 100
        },
        "items": {
          "type": "array",
          "minItems": 1,
          "maxItems": 8,
          "items": {
            "type": "object",
            "required": ["title", "description"],
            "properties": {
              "title": {
                "type": "string",
                "minLength": 5,
                "maxLength": 80
              },
              "description": {
                "type": "string",
                "minLength": 20,
                "maxLength": 300
              }
            }
          }
        }
      }
    }
  }
}
