{
  "layout": "landing-page-anduril",
  "meta": {
    "title": "Measurable Climate & Community Impact | Citypack",
    "description": "Track emissions avoided, noise reduction, and vendor adoption across your portable power fleet. Data for grant reporting and policy decisions."
  },
  "hero": {
    "category": "IMPACT",
    "title": "Cleaner Air, Quieter Streets, Measurable Results",
    "description": "Track emissions, noise, and user adoption across your entire portable power fleet. Reporting aligned with CPA grant requirements and city climate action plans.",
    "cta": {
      "primary": {
        "text": "Get Sample Impact Dashboard",
        "href": "/resources"
      },
      "secondary": {
        "text": "Talk to Our Team",
        "href": "/contact"
      }
    }
  },
  "benefits": {
    "title": "Climate & Air Quality Impact",
    "items": [
      {
        "title": "Emissions Reduction",
        "description": "[PLACEHOLDER: Up to 15-17 tCOâ‚‚ avoided per starter fleet per year. Eliminates NOx, PM2.5, and carbon monoxide from small gas generators. Supports California's small off-road engine regulations and city climate commitments.]"
      },
      {
        "title": "Generator-Hours Replaced",
        "description": "[PLACEHOLDER: Thousands of vendor generator-hours avoided annually across markets, events, and park rentals. Real-time tracking of battery kWh delivered vs. equivalent generator fuel consumption.]"
      },
      {
        "title": "Policy Pathway",
        "description": "Pilot data supports permanent clean power requirements in event permits and park rentals. Help staff make the case to Council with measured outcomes, not projections."
      }
    ]
  },
  "features": {
    "title": "Community & Equity Benefits",
    "items": [
      {
        "title": "Noise Elimination",
        "description": "[PLACEHOLDER: >90% noise reduction at markets and events vs. gas generators. Residents can enjoy community gatherings without constant engine drone. Vendors report improved customer interactions without shouting over generators.]"
      },
      {
        "title": "Small Vendor Support",
        "description": "[PLACEHOLDER: Subsidy-first model during pilot ensures low-margin vendors aren't priced out. Gradual cost-sharing transition as program scales. Educational support for vendors transitioning from generator ownership.]"
      },
      {
        "title": "Health & Safety",
        "description": "Eliminates exhaust fumes in crowded public spaces like farmers markets. Reduces fire risk in parks during dry seasons. LFP battery chemistry provides thermal stability for deployments near crowds and children."
      },
      {
        "title": "Cost Transparency",
        "description": "[PLACEHOLDER: Compare total cost of ownership: generator purchase + fuel + maintenance + staff time vs. managed battery fleet with shared costs. Business case templates for Council presentations and budget justification.]"
      }
    ]
  }
}
