{
  "layout": "landing-page-anduril",
  "meta": {
    "title": "Contact LAB SEVEN | Labrador Field Systems",
    "description": "Contact Labrador Field Systems to book LAB SEVEN or for product info. Professional battery power rental support."
  },
  "hero": {
    "category": "CONTACT",
    "title": "Get in Touch",
    "description": "Ready to rent LAB SEVEN? Have questions about the system? Want to discuss custom power solutions? We're here to help. Contact Labrador Field Systems for rentals, demos, and product information.",
    "cta": {
      "primary": {
        "text": "Email Labrador",
        "href": "mailto:amit@fieldpack.co"
      },
      "secondary": {
        "text": "Call Now",
        "href": "tel:+13107760154"
      }
    }
  },
  "benefits": {
    "title": "How to Reach Us",
    "items": [
      {
        "title": "Rental Bookings",
        "description": "Contact Labrador Field Systems to check availability, book your rental, or discuss multi-day packages and volume discounts."
      },
      {
        "title": "Product Questions",
        "description": "Reach out to Labrador Field Systems for technical specifications, custom configurations, or partnership opportunities."
      },
      {
        "title": "Technical Support",
        "description": "Active renters receive 24/7 technical support during their rental period. Non-urgent questions answered during business hours."
      }
    ]
  },
  "features": {
    "title": "Contact Information",
    "items": [
      {
        "title": "Labrador Field Systems",
        "description": "Primary rental partner for LAB SEVEN battery systems in Los Angeles area. Full-service equipment rental house with delivery, setup, and support. Phone: 310-776-0154 | Email: amit@fieldpack.co"
      },
      {
        "title": "Rental Booking Process",
        "description": "Call or email Labrador Field Systems with your shoot dates, location, and power requirements. Mention promo code \"241\" for one free rental day on first booking. We'll confirm availability and coordinate delivery."
      },
      {
        "title": "Demo and Site Visits",
        "description": "Want to see LAB SEVEN before your rental? We can arrange product demonstrations or site visits for qualified productions. Contact Labrador Field Systems to schedule."
      },
      {
        "title": "Custom Power Solutions",
        "description": "Multi-unit installations, extended productions, festival power, or unique requirements? Contact Labrador directly to discuss custom configurations and support."
      }
    ]
  }
}
